番号,title,住所,lat,lng,
SA146,八大天王社宮跡,左京区一乗寺松原町,35.02303,135.47454,
SA147,岩倉具視公避匿所,左京区岩倉上蔵町,35.04408,135.46338,
SA148,東松ヶ崎の生活用水井戸跡,左京区松ヶ崎東町,35.03125,135.47046,
SA149,三宅八幡宮・岩倉観世音【道標】,左京区静市市原町(頼光橋西詰),35.04193,135.46055,
SA150,金毘羅山の町石・四町【道標】,左京区静市静原町(江文峠山中),35.0659,135.48297,
SA151,江文寺の趾,左京区静市静原町(江文峠山中),35.06561,135.48309,
SA152,妙源庵跡,左京区岩倉長谷町,,,
SA153,孝明天皇御衣更処茶屋跡,左京区下鴨松原町,35.02154,135.46144,
SA154,糺の森,左京区下鴨泉川町,35.0203,135.46159,
SA155,吉田松陰拝闕詩碑,左京区岡崎成勝寺町(京都府立図書館内),35.00455,135.46561,
SA156,唱導師日像聖人巡錫地,左京区下鴨松ノ木町,35.02223,135.4614,
SA157,今宮社址,左京区吉田神楽岡町(吉田神社内),,,
SA158,徳富蘇峰先生勉学処,左京区田中西樋ノ口町(田中神社内),35.02059,135.46552,
SA159,北白川宮元精米所御殿車,左京区北白川琵琶町,35.01545,135.48024,
SA160,--,,,,
SA161,--,,,,
SA162,--,,,,
SA163,--,,,,
SA164,真如堂【道標】,左京区浄土寺石橋町,35.01381,135.47391,
SA165,--,,,,
SA166,粟田山陵・亀山天皇分骨所【道標】,左京区南禅寺福地町,35.00403,135.47182,
SA167,粟田山陵・亀山天皇分骨所【道標】,左京区南禅寺福地町(南禅寺内),35.00398,135.47302,
SA168,駒ヶ瀧最勝院是ヨリ一丁【道標】,左京区南禅寺福地町,35.0039,135.47381,
SA169,最勝院【道標】,左京区南禅寺風呂山町(南禅寺南禅院前),35.00376,135.47392,
SA170,駒ヶ瀧最勝院【道標】,左京区南禅寺福地町(南禅寺最勝院前),35.00383,135.47416,
SA171,--,,,,
SA172,--,,,,
SA173,--,,,,
SA174,--,,,,
SA175,--,,,,
SA176,勝軍地蔵尊【道標】,左京区北白川別当町,35.01468,135.47303,
SA177,別所・京道【道標】,左京区花脊別所町,35.0955,135.46499,
SA178,銀閣寺道【道標】,左京区下鴨北園町,35.02506,135.46174,
SA179,二本松【道標】,左京区下鴨貴船町,35.02359,135.46034,
SA180,見真大師聖蹟法泉寺,左京区下鴨松ノ木町(法泉寺前),35.02296,135.46156,
SA181,新島襄先生墓地登り口【道標】,左京区若王子町,35.00558,135.4737,
SA182,粟田山陵・冷泉天皇陵【道標】,左京区若王子町,35.0056,135.4737,
SA183,光雲寺【道標】,左京区南禅寺北ノ坊町,35.01017,135.47455,
SA184,安楽寺・法然院・銀閣寺道【道標】,左京区鹿ヶ谷寺ノ前町,35.01128,135.47379,
SA185,光雲寺【道標】,左京区鹿ヶ谷下宮ノ前町,35.01006,135.47366,
SA186,後一条天皇陵・陽成天皇陵参道【道標】,左京区浄土寺西田町,35.01407,135.47247,
SA187,行者の森・大文字山参道【道標】,左京区銀閣寺町,35.01403,135.47535,
SA188,銀閣寺・北白川方面【道標】,左京区浄土寺大山町,35.01243,135.48161,
SA189,勝軍地蔵参道【道標】,左京区北白川山ノ元町,,,
SA190,黒谷・真如堂【道標】,左京区岡崎東天王町(岡崎神社内),35.01018,135.47207,
SA191,永観堂道【道標】,左京区岡崎東天王町(岡崎神社内),35.01018,135.47207,
SA192,後一条天皇陵・陽成天皇陵参道【道標】,左京区黒谷町,35.01059,135.47089,
SA193,平安神宮是ヨリ東北へ三丁【道標】,左京区聖護院蓮華蔵町,35.00513,135.46374,
SA194,皇太子慶頼王墓・中宮安子火葬塚参道【道標】,左京区吉田牛ノ宮町,35.01307,135.46377,
SA195,後二条天皇陵・後一条天皇陵・冷泉天皇陵参道【道標】,左京区吉田神楽岡町,35.01435,135.47103,
SA196,栗栖野瓦窯跡,左京区岩倉幡枝町,,,
SA197,比叡山無動寺大弁財天道【道標】,左京区高野玉岡町,35.02388,135.46591,
SA198,くろたに道【道標】,左京区浄土寺真如町(真正極楽寺内),35.01125,135.47233,
SA199,法然上人旧跡しうん石【道標】,左京区黒谷町(金戒光明寺墓地入口),35.01073,135.47187,
SA200,藤村庸軒翁墓【道標】,左京区黒谷町(金戒光明寺墓地入口),35.01073,135.47187,
SA201,山崎闇斎先生墳墓【道標】,左京区黒谷町(金戒光明寺墓地入口),35.01073,135.47187,
SA202,竹内栖鳳先生墓【道標】,左京区黒谷町(金戒光明寺墓地入口),35.01073,135.47187,
SA203,--,,,,
SA204,楠木正成塚,左京区修学院室町,35.03151,135.47548,
SA205,岩倉観世音・三宅八幡宮道【道標】,左京区静市野中町,,,
SA206,松ヶ崎大黒天道【道標】,左京区山端壱町田町,35.0303,135.47259,
SA207,新島襄先生墓所参道【道標】,左京区若王子町,35.00553,135.47455,
SA208,坂本道【道標】,左京区北白川山ノ元町,35.01545,135.47474,
SA209,--,,,,
SA210,俊寛僧都旧跡道【道標】,左京区鹿ヶ谷栗木谷町,,,
SA211,三条通【道標】,左京区南禅寺草川町,35.00388,135.47053,
SA212,摩利支天堂道【道標】,左京区南禅寺草川町,35.00425,135.47303,
SA213,帰雲院【道標】,左京区永観堂町(正的院前),35.00452,135.47371,
SA214,正的院墓参道【道標】,左京区南禅寺草川町(正的院前),35.00452,135.47371,
SA215,粟田山陵・亀山天皇分骨所参道【道標】,左京区南禅寺風呂山町(南禅院西側),35.00375,135.47362,
SA216,円光大師旧跡しうん石【道標】,左京区黒谷町(金戒光明寺墓地内),35.01077,135.47205,
SA217,赤松小三郎先生墓所【道標】,左京区黒谷町(金戒光明寺墓地内),35.01077,135.47205,
SA218,旧錦林第二小学校跡,左京区吉田近衛町(近衛中学校前),35.01185,135.46457,
SA219,京都博覧会碑,左京区岡崎成勝寺町(京都市勧業館内),35.00467,135.46538,緯度疑義あり
SA220,重修白幽子墓,左京区浄土寺下馬場町(吉田神葬墓地内),35.01249,135.47208,
SA221,崇道神社碑,左京区上高野西明寺山(崇道神社内),35.03549,135.48017,
SA222,阿弥陀経石碑,左京区田中門前町(知恩寺内),35.01457,135.46506,
SA223,大典記念植物園設立記念碑,左京区下鴨半木町(京都府立植物園内),35.025,135.45412,
SA224,高野河原開墾来歴碑,左京区高野上竹屋町(加茂波爾神社内),35.02351,135.46563,
SA225,幡枝切通碑,左京区岩倉幡枝町(圓通寺前),35.0351,135.4603,
SA226,大正大礼記念碑,左京区岡崎西天王町(平安神宮内),35.0055,135.46545,
SA227,右三条／左大原【道標】,左京区高野東開町(高野第三住宅内),35.02228,135.46467,
SA228,琵琶湖疏水工事殉難者碑,左京区粟田口山下町,35.00264,135.47272,
SA229,田辺朔郎紀功碑,左京区粟田口山下町,35.00294,135.47276,
SA230,平安遷都紀念塔,左京区上高野東山,35.03565,135.4834,
SA231,ワグネル碑,左京区岡崎成勝寺町,35.0048,135.46547,
SA232,レオン・ジュリー碑,左京区吉田泉殿町(関西日仏学館内),35.01336,135.46413,
SA233,韓国合併奉告祭碑,左京区上高野三宅町(三宅八幡神社内),35.04049,135.47393,
SA234,北白川石工共和組紀念碑,左京区北白川山ノ元町,,,
SA235,今井庄治郎君碑,左京区黒谷町(金戒光明寺墓地内),35.01111,135.47222,
SA236,白川女碑,左京区北白川下池田町(北白川天神宮内),35.01465,135.47439,
SA237,小野蘭山顕頌碑,左京区下鴨半木町(京都府立植物園内),35.02548,135.45507,
SA238,今尾景年画龍碑,左京区南禅寺福地町(南禅寺内),35.00419,135.47339,
SA239,洛北地区土地区画整理竣工記念碑,左京区下鴨萩ヶ垣内町(萩児童公園内),35.02572,135.46097,
SA240,小林君碑,左京区浄土寺真如町(真正極楽寺内),35.0115,135.4723,
SA241,復租紀恩碑,左京区八瀬秋元町(八瀬天満宮内),35.05015,135.4906,
SA242,五味藤九郎碑,左京区上高野西明寺山(崇道神社内),35.03524,135.48019,
SA243,林又一郎顕彰碑,左京区黒谷町(金戒光明寺内),35.01081,135.47177,
SA244,是より西南山城国・是より東北近江国【道標】,左京区北白川重石町,35.0226,135.48587,
SA245,後一条天皇陵・陽成天皇陵・冷泉天皇陵参道【道標】,左京区浄土寺真如町,35.01206,135.47182,
SA246,粟田陶隠木米記念碑,左京区粟田口三条坊町(青蓮院内),35.00289,135.46592,
SA247,売茶翁没後二百五十年記念碑,左京区下鴨半木町(北大路橋東詰),35.02402,135.45462,
SA248,東方斎荒尾先生碑,左京区若王子町,35.00556,135.47455,
SA249,東方斎居址,左京区若王子町,35.00555,135.47476,
SA250,征清殉難九烈士表紹碑,左京区若王子町,35.00553,135.47455,
SA251,修学院村道路元標,左京区山端川原町,35.03036,135.47248,
SA252,二宮尊徳像,左京区岡崎成勝寺町(京都府立図書館前),35.00476,135.46565,
SA253,静市野村道路元標,左京区静市野中町(専称寺前),35.05268,135.45511,
SA254,芭蕉翁碑銘,左京区一乗寺才形町(金福寺内),35.02315,135.47438,
SA255,金福寺,左京区一乗寺才形町(金福寺前),35.0232,135.47419,
SA256,尊攘堂,左京区吉田本町(京都大学内),35.01366,135.46451,
SA257,蓼倉川水路開鑿碑,左京区下鴨宮崎町(下鴨小学校内),35.02125,135.46058,
SA258,加茂之荘地区土地区画整理竣功記念碑,左京区下鴨北茶ノ木町(茶ノ木原児童公園内),35.03174,135.46184,
SA259,葵公園碑,左京区下鴨宮河町(鴨川公園内),35.0154,135.46169,
SA260,松賀茂地区土地区画整理竣功記念碑,左京区松ヶ崎芝本町(松賀茂児童公園内),35.03004,135.46256,
SA261,下鴨地区土地区画整理竣工記念碑,左京区下鴨東梅ノ木町(あおい児童公園内),35.02432,135.46259,
SA262,冷泉天皇陵参道【道標】,左京区銀閣寺前町(銀閣寺橋西詰),35.01381,135.47419,
SA263,伏見淀鳥羽戦死者道しるべ,左京区黒谷町(金戒光明寺会津墓地内),35.01124,135.47234,
SA264,岩倉陵・実相院宮墓参道六丁【道標】,左京区岩倉中町(旧左京区役所岩倉出張所内),35.04312,135.47185,
SI001,本居宣長先生修学地,下京区綾小路室町西入南側,35.00091,135.45258,
SI002,鈴屋大人寓講学旧地,下京区烏丸通四条下る東側,35.00118,135.45354,
SI003,電気鉄道事業発祥地,下京区塩小路通東洞院南西角,34.59137,135.45397,
SI004,桜田儀兵衛氏碑,下京区下之町(京都市崇仁隣保館前),34.59106,135.45521,
SI005,古高俊太郎邸址,下京区河原町通四条上る一筋目東入南側,35.00142,135.46113,
SI006,松永貞徳花咲亭址,下京区間之町通松原上る西側(花咲大明神前),34.59579,135.45425,
SI007,妙満寺跡・二十六聖人発祥地,下京区岩上通綾小路東北角,35.00091,135.45044,
SI008,柴田鳩翁脩正舎址,所在不明(下京区五条通東洞院東入北側カ),,,
SI009,道元禅師遺蹟地,下京区高辻通西洞院西入北側,35.00006,135.45168,
SI010,源語伝説五条辺夕顔墳,下京区堺町通松原上る西側,34.59586,135.45476,
SI011,鉄輪跡,下京区堺町通万寿寺上る西側,34.59533,135.45479,
SI012,円山応挙宅址,下京区四条通堺町東入南側,35.00141,135.4548,
SI013,成徳尋常小学校跡,下京区室町通綾小路下る東側,35.0007,135.45286,
SI014,松本宗悟邸址,下京区室町通仏光寺上る東側,35.00067,135.45279,
SI015,北村季吟先生遺蹟,下京区松原通烏丸西入南側(新玉津嶋神社前),34.5956,135.45326,
SI016,丹波国亀山藩京屋敷跡,下京区松原通室町西入北側(花月明神前),34.5956,135.45266,
SI017,幸野楳嶺生誕地,下京区新町通四条下る西側,35.0011,135.45241,
SI018,明治天皇行幸地,下京区新町通万寿寺上る東側(修徳特別養護老人ホーム内),34.59515,135.45239,
SI019,東鴻臚館址,下京区西新屋敷揚屋町(角屋前),34.59332,135.44348,
SI020,長州藩士久坂玄瑞の密議の角屋,下京区西新屋敷揚屋町(角屋前),34.59329,135.44359,
SI021,化粧水,下京区西洞院通四条東南角,35.00129,135.45186,
SI022,菅家邸址,下京区仏光寺通西洞院東入南側,35.00045,135.45209,
SI023,三善清行邸跡,下京区醒ヶ井通松原下る東側(醒泉小学校内),34.59537,135.45095,
SI024,贈従五位赤松小三郎先生記念,下京区東洞院通鍵屋町下る西側,34.59409,135.45395,
SI025,与謝蕪村宅跡,下京区仏光寺通烏丸西入南側,35.00047,135.45322,
SI026,肥後藩屋敷跡,下京区仏光寺通壬生川西南角,35.00045,135.44448,
SI027,八幡太郎義家誕生地,下京区若宮通六条下る東側(若宮八幡宮前),34.59365,135.45213,
SI028,菅家邸址,下京区仏光寺通西洞院東入北側,35.00047,135.45212,
SI029,当道職屋敷址,下京区仏光寺通東洞院東入北側(洛央小学校前),35.00048,135.45421,
SI030,左女牛井跡,下京区堀川通五条下る西側,34.59398,135.45079,
SI031,源融河原院址,下京区木屋町通五条下る東側,34.59425,135.46018,
SI032,芹根水,下京区木津屋橋通堀川西入下る東側,34.59142,135.45077,
SI033,中井正五郎殉難地,下京区油小路通旧花屋町下る西側,34.59313,135.45136,
SI034,山本亡羊読書室旧蹟,下京区油小路通五条上る西側,34.59479,135.45135,
SI035,伊東甲子太郎外数名殉難跡,下京区油小路通木津屋橋上る東側(本光寺前),34.59165,135.45134,
SI036,平清盛公西八条殿跡,下京区七条御所ノ内本町(若一神社内),34.59038,135.43581,
SI037,島原西門碑,下京区西新屋敷下之町(島原住吉稲荷神社前),34.59354,135.44339,
SI038,新開道路碑,下京区花屋町通堀川西南角,34.59344,135.45096,
SI039,長曽我部盛親公埋首地,下京区富小路通五条下る(蓮光寺前),34.594,135.45498,
SI040,石門心学脩正舎,下京区麩屋町通五条上る東側,34.5947,135.45559,
SI041,明治天皇行幸所下京第二十四組小学校,下京区鍵屋町通室町西入北側(下京中学校前),34.5942,135.45269,
SI042,八橋検校道場跡,下京区室町通綾小路上る西側,35.00097,135.45285,
SI043,亀山藩邸鎮守社白滝・花月大明神碑,下京区松原通室町西入(白滝・花月大明神内),34.59569,135.45265,
SI044,大雲院跡,下京区寺町通四条下る西側,35.00112,135.46008,
SI045,鎮西聖光上人遺蹤,下京区寺町通仏光寺上る東側(聖光寺前),35.00068,135.46007,
SI046,豊園小学校の碑,下京区仏光寺通東洞院東入北側(洛央小学校前),35.00047,135.45432,
SI047,豊園幼稚園記念碑,下京区仏光寺通東洞院東入北側(洛央小学校前),35.00048,135.45417,
SI048,道元禅師示寂聖地,下京区高辻通西洞院西入北側,35.00007,135.45166,
SI049,天満宮降誕地,下京区高辻通西洞院東入北側,35.00012,135.45209,
SI050,天満宮降誕地,下京区西洞院通高辻上る東側,35.00014,135.45183,
SI051,天満宮降誕地,下京区仏光寺通西洞院東入南側,35.00045,135.45208,
SI052,元六条御所長講堂,下京区富小路通六条上る東側(長講堂前),34.59388,135.45495,
SI053,是より洛中碑,下京区大宮通塩小路下る(梅逕中学校内),34.59112,135.4459,
SI054,悪王子社趾,下京区東洞院通四条下る西側,35.00123,135.45402,
SI055,道了大薩■【道標】,下京区西七条北西野町,34.59217,135.4401,
SI056,明治天皇御小休所枳殻邸,下京区下珠数屋町通間之町東入(渉成園内),34.59271,135.45464,
SI057,平安京朱雀大路跡,下京区中堂寺坊城町,34.59427,135.44351,
SI058,歌舞練場跡記念碑,下京区西新屋敷中之町,,,
SI059,佐賀鍋島藩屋敷跡,下京区四条通堺町通南東角,35.0013,135.45505,
SI060,銭座場跡,下京区下之町(柳原銀行記念資料館前),34.59103,135.45522,
SI061,尚徳中学校の碑,下京区鍵屋町通室町西入北側(下京中学校前),34.5942,135.45269,
SI062,医祖神碣,下京区西洞院通松原下る西側(五条天神社内),34.59546,135.45173,
SI063,是より洛中碑,下京区朱雀堂ノ口町(京都市中央卸売市場第一市場内),34.59213,135.44323,
SI064,文房四神碑,下京区木津屋橋通堀川西入下る東側,34.59142,135.45077,
SI065,是より南　六条御境内【道標】,下京区堀川通五条下る西側,34.59387,135.45079,
SI066,明治天皇御小休所本願寺旧大教校,下京区大工町(龍谷大学正門前),34.59234,135.45023,
SI067,新選組洛中最後の屋敷跡,下京区西洞院通塩小路下る西側,34.5913,135.45185,
SI068,道路開鑿紀念碑,下京区下之町(崇仁コミュニティセンター内),34.59104,135.45524,
SI069,源為義塚移建碑,下京区朱雀裏畑町(権現寺前),34.59196,135.44232,
SI070,六条判官源為義公塚,下京区朱雀裏畑町(権現寺前),34.59196,135.44232,
SI071,小野寺十内妻丹女墓,下京区岩上通五条上る東側,34.59511,135.45053,
UK001,陶工仁清窯址,右京区御室竪町,35.01326,135.42563,
UK002-1,千代の古道,右京区嵯峨釣殿町(児神社内),35.01331,135.4115,
UK002-2,千代の古道,右京区山越中町(山越交叉点南西角),35.0137,135.41431,
UK002-3,千代の古道,右京区嵯峨大沢落久保町,35.01386,135.4108,
UK002-4,千代の古道,右京区太秦御領田町,35.01282,135.41508,
UK002-5,千代の古道,右京区山越東町,35.01241,135.41537,
UK002-6,千代の古道,右京区太秦開日町,35.01163,135.41531,
UK003,源融公栖霞観地,右京区嵯峨釈迦堂藤ノ木町(清凉寺前),35.01212,135.40286,
UK004,祇王祇女仏刀自旧跡,右京区嵯峨鳥居本小坂(祇王寺境内),35.00129,135.40007,
UK005,桓武天皇勅営角倉址・了以翁邸址・平安初期鋳銭司旧址,右京区嵯峨天龍寺角倉町(公立学校共済組合嵐山保養所花のいえ前),35.00499,135.40526,
UK006,西行法師庵の跡,右京区嵯峨二尊院門前長神町(二尊院境内),35.01187,135.40097,
UK007,小倉山荘旧址厭離庵,右京区嵯峨二尊院門前北中院町,35.012,135.40157,
UK008*,さざれ石,右京区山越中町入亀山山麓及び山頂,,,
UK009,平塚瓢斎先生宅趾,右京区西院坤町,35.00129,135.43369,
UK010,淳和院跡,右京区西院高山寺町(高山寺前),35.00131,135.43564,
UK011,大映京都撮影所跡地,右京区太秦多藪町,35.00467,135.42113,
UK012,日本最古の茶園,右京区梅ヶ畑栂尾町(高山寺内),35.03387,135.40418,
UK013,名古曽滝址,右京区北嵯峨名古曽町,35.01486,135.40506,
UK014,京都市登録史跡御堂ヶ池一号墳,所在不明(右京区鳴滝音戸山町カ),,,
UK015,尾形乾山宅跡,右京区鳴滝泉谷町(法蔵寺前),35.01553,135.42199,
UK016,琴きき橋跡,右京区嵯峨天龍寺造路町(渡月橋北詰),35.00491,135.40413,
UK017,旧川村曼舟画伯邸,所在不明(右京区嵐山渡月橋畔内),,,
UK018,清水山古墳跡,右京区太秦松本町,35.00307,135.42444,
UK019,小倉百人一首編纂の地,右京区嵯峨小倉山町(常寂光寺境内),35.0112,135.40083,
UK020,壇林寺旧跡・前中書王遺跡,右京区嵯峨天龍寺茫ノ馬場町,35.01036,135.40279,
UK021,太郎坊の井戸,右京区太秦宮ノ前町,35.01107,135.41599,
UK022,牛若丸首途の井,右京区花園艮北町,35.0116,135.43262,
UK023,法眼宅間勝賀終焉地,右京区鳴滝宅間町(周山街道三宝寺橋南詰),35.01563,135.4211,
UK024,法輪寺道昌遺業大堰阯,右京区嵯峨天龍寺芒ノ馬場町,35.00479,135.40293,
UK025,兼好法師旧跡,右京区御室岡ノ裾町(長泉寺門前),35.01254,135.42566,
UK026,生の六道　小野篁公遺跡,右京区嵯峨釈迦堂藤ノ木町(薬師寺内),35.01237,135.40253,
UK027,夕霧大夫遺跡,右京区嵯峨二尊院門前北中院町,35.0123,135.40234,
UK028,天龍寺塔中招慶院旧址,右京区嵯峨釈迦堂大門町(右京区役所嵯峨出張所前),35.01146,135.40325,
UK029,小督局墳,右京区嵯峨天龍寺芒ノ馬場町,35.00487,135.4035,
UK030,旧御室御所茶所,右京区山越西町(印空寺前),35.01358,135.4141,
UK031,了海上人遺跡,右京区山越西町(印空寺前),35.01358,135.41409,
UK032,中御所阯,右京区北嵯峨名古曽町,35.01487,135.405,
UK033,若宮社旧蹟,右京区山ノ内瀬戸畑町,35.00205,135.43217,
UK034,東衣手町遺跡,右京区西京極東衣手町(三宮社衣手神社前),34.59517,135.42383,
UK035,尾形乾山陶窯跡地,右京区鳴滝泉谷町(法蔵寺前),35.01553,135.42199,
UK036,大沢池附名古曽滝趾,右京区嵯峨大沢町,35.01392,135.40447,
UK037,御室・高雄【道標】,右京区花園寺ノ内町(ＪＲ花園駅前),35.01089,135.43051,
UK038,栂尾・槙尾・丹波道【道標】,右京区梅ヶ畑檜社町(清滝大権現前),35.03143,135.40347,
UK039,愛宕道【道標】,右京区竜安寺衣笠下町,35.01538,135.43098,
UK040,愛宕道【道標】,右京区嵯峨大覚寺門前六道町,35.01239,135.40398,
UK041,野々宮【道標】,右京区嵯峨釈迦堂門前南中院町,35.012,135.40165,
UK042,愛宕道【道標】,右京区嵯峨二尊院門前長神町,35.01199,135.40102,
UK043,愛宕道／祇王寺【道標】,右京区嵯峨二尊院門前往生院町,35.01233,135.40073,
UK044,愛宕山道／念仏寺【道標】,右京区嵯峨鳥居本化野町,35.01344,135.40005,
UK045,愛宕道／化野念仏寺【道標】,右京区嵯峨鳥居本化野町(化野念仏寺前),35.01366,135.39563,
UK046,三条通・六条・伏見【道標】,右京区嵯峨野嵯峨ノ段町(甲塚橋東詰),35.01116,135.41296,
UK047,高雄・田尻・丹波・山【道標】,右京区愛宕山上,35.04179,135.38339,
UK048,丹波・桂渡し・善峯道【道標】,右京区西院春日町(西院小学校内),35.00199,135.4348,
UK049,祇王寺【道標】,右京区嵯峨鳥居本小坂町(祇王寺内),35.01239,135.40022,
UK050,祇王寺・久保田米僊・金子静枝墓【道標】,右京区嵯峨二尊院門前往生院町,35.01236,135.40066,
UK051,大覚寺近道【道標】,右京区嵯峨鳥居本六反町,35.01329,135.40045,
UK052,大覚寺北十町【道標】,右京区嵯峨天竜寺造路町,35.00491,135.40412,
UK053,大覚寺北八町【道標】,右京区嵯峨天竜寺車道町,35.0059,135.40484,
UK054,天龍寺・嵐山【道標】,右京区嵯峨天竜寺立石町,35.01035,135.40348,
UK055,大覚寺・大沢池・広沢池【道標】,右京区嵯峨観空寺明水町,35.01377,135.40383,
UK056,化野・一の鳥居・愛宕道【道標】,右京区嵯峨釈迦堂藤ノ木町,35.01315,135.40334,
UK057,大覚寺東三町【道標】,右京区嵯峨釈迦堂藤ノ木町(清凉寺前),35.01216,135.40297,
UK058,釈迦堂前街道【道標】,右京区嵯峨小倉山緋明神町,35.01142,135.40175,
UK059,小倉山・常寂光寺・歌仙祠【道標】,右京区嵯峨小倉山小倉町,35.01111,135.40137,
UK060,大覚寺西五丁／広沢の池【道標】,右京区嵯峨広沢町,35.0131,135.41223,
UK061,大覚寺・大沢池・名古曽滝址道【道標】,右京区嵯峨大覚寺門前六道町,35.01262,135.40435,
UK062,遍照寺山【道標】,右京区北嵯峨赤阪町,35.01501,135.40582,
UK063,広沢池・御室街道【道標】,右京区北嵯峨赤阪町,35.01501,135.40582,
UK064,高雄道・長刀坂・後宇多帝陵【道標】,右京区北嵯峨名古曽町,35.01479,135.40425,
UK065,直指庵【道標】,右京区北嵯峨北ノ段町,35.01481,135.40425,
UK066,春日潜庵先生墓【道標】,右京区鳴滝泉谷町(法蔵寺前),35.01552,135.42199,
UK067,三条・二条・下立売・太秦広隆寺門前【道標】,右京区太秦森ヶ東町(木島神社前),35.00499,135.42489,
UK068,蚕神社【道標】,右京区太秦森ヶ東町(木島神社前),35.00499,135.42486,
UK069,泉谷・高雄【道標】,所在不明(右京区宇多野福王子町カ),,,
UK070,愛宕道【道標】,所在不明(右京区嵯峨広沢西裏町カ),,,
UK071,愛宕道【道標】,所在不明(右京区嵯峨鳥居本深谷町カ),,,
UK072,篠山藩周山代官所・北桑田郡役所・京都府京北事務所跡,右京区京北周山町上代,35.09229,135.37514,
UK073,小楠公御首塚の寺【道標】,右京区嵯峨釈迦堂藤ノ木町(清凉寺前),35.01212,135.40286,
UK074,小倉山・二尊院西二町【道標】,右京区嵯峨釈迦堂藤ノ木町(清凉寺前),35.01212,135.40286,
UK075,嵯峨帝陵東北十六町【道標】,右京区嵯峨釈迦堂藤ノ木町(清凉寺前),35.01212,135.40286,
UK076,御室・北野方面【道標】,右京区嵯峨釈迦堂藤ノ木町(清凉寺前),35.01212,135.40286,
UK077,嵐山【道標】,右京区嵯峨天龍寺芒ノ馬場町,35.00528,135.40285,
UK078,花園村道路元標,右京区花園寺ノ前町(妙心寺勅使門前),35.01154,135.43117,
UK079,新田公首塚碑道【道標】,右京区嵯峨二尊院門前往生院町,35.01236,135.40067,
UK080,檀林寺門跡【道標】,右京区嵯峨二尊院門前往生院町,35.01233,135.40072,
UK081,梅宮参詣道【道標】,右京区嵯峨野宮ノ元町,35.0051,135.41373,
UK082,福王子神社祭神班子皇后北一町【道標】,右京区宇多野福王子町(福王子神社内),35.01442,135.42319,
UK083,松尾・梅宮道【道標】,右京区梅津中村町(梅津小学校内),35.00044,135.42035,
UK084,松尾神社・嵐山道【道標】,右京区梅津前田町,35.00126,135.41459,
UK085,七保天満宮旧蹟,右京区花園艮北町(成願寺内),35.0116,135.43308,
